{
  "$schema": "https://json-schema.org/draft/2020-12/schema",
  "$id": "https://fatb4f.github.io/schemas/project_manifest.schema.json",
  "title": "Project Manifest",
  "type": "object",
  "additionalProperties": false,
  "required": [
    "kind",
    "project_id",
    "scope",
    "authority",
    "priority_assets",
    "agent_contract",
    "review_rules",
    "execution_states",
    "schema_contract",
    "review_template"
  ],
  "properties": {
    "kind": {
      "type": "string",
      "pattern": "^[A-Za-z0-9_.-]+\\.project_manifest\\.v[0-9]+$"
    },
    "project_id": {
      "type": "string",
      "minLength": 1
    },
    "scope": {
      "type": "string",
      "minLength": 1
    },
    "authority": {
      "type": "object",
      "additionalProperties": false,
      "required": [
        "primary_surface",
        "runtime_install_required_by_default",
        "notes"
      ],
      "properties": {
        "primary_surface": {
          "type": "string",
          "minLength": 1
        },
        "runtime_install_required_by_default": {
          "type": "boolean"
        },
        "notes": {
          "type": "array",
          "items": {
            "type": "string",
            "minLength": 1
          }
        }
      }
    },
    "priority_assets": {
      "type": "object",
      "additionalProperties": false,
      "required": [
        "entrypoint_files",
        "project_dirs"
      ],
      "properties": {
        "entrypoint_files": {
          "type": "array",
          "items": {
            "$ref": "#/$defs/top_level_name"
          }
        },
        "project_dirs": {
          "type": "array",
          "items": {
            "$ref": "#/$defs/top_level_name"
          }
        }
      }
    },
    "agent_contract": {
      "type": "object",
      "additionalProperties": false,
      "required": [
        "required_behavior"
      ],
      "properties": {
        "required_behavior": {
          "type": "array",
          "items": {
            "type": "string",
            "minLength": 1
          }
        }
      }
    },
    "review_rules": {
      "type": "object",
      "additionalProperties": true
    },
    "execution_states": {
      "type": "array",
      "items": {
        "type": "string",
        "minLength": 1
      }
    },
    "schema_contract": {
      "type": "object",
      "additionalProperties": true,
      "required": [
        "generic_base_schema",
        "project_profile_schema",
        "compatibility_schema",
        "project_template",
        "profile_schema_id",
        "compatibility_schema_id",
        "profile_title",
        "project_review_kind",
        "artifact_name_pattern"
      ],
      "properties": {
        "generic_base_schema": {
          "$ref": "#/$defs/repo_relative_path"
        },
        "project_profile_schema": {
          "$ref": "#/$defs/repo_relative_path"
        },
        "compatibility_schema": {
          "$ref": "#/$defs/repo_relative_path"
        },
        "project_template": {
          "$ref": "#/$defs/repo_relative_path"
        }
      }
    },
    "review_template": {
      "type": "object"
    }
  },
  "$defs": {
    "repo_relative_path": {
      "type": "string",
      "pattern": "^(?!$)(?!/)(?!~)(?!\\.\\.?($|/))(?!.*//)(?!.*(?:^|/)\\.\\.(?:/|$)).+$"
    },
    "top_level_name": {
      "type": "string",
      "pattern": "^(?!$)(?!/)(?!.*//)(?!.*\\/).+$"
    }
  }
}
